series,location,keywords,numpages,pages,booktitle,abstract,doi,url,address,publisher,isbn,year,title,author,ENTRYTYPE,ID,month,journal,note,issn,articleno,number,volume,issue_date
CHI '25,,"Text-to-Image, Image Creation, Creation Workflow, Generative AI",17,,Proceedings of the 2025 CHI Conference on Human Factors in Computing Systems,"The emergence of AI Image Generators (AIGs) has transformed image creation, making it more accessible to generate customized images from simple text prompts. While HCI research has explored the applications of text-to-image generation, the role of AIGs in visual content creation workflow remains relatively underexplored. To address this, we conducted in-depth interviews with 26 end users who had experience across 14 different AIGs and investigated users’ adoption and perceptions of AIGs and AI’s role throughout the entire workflow. Key factors examined include user goals, initial vision, tool integration, and decision-making. Our results indicated that functional goals often drive cross-tool integration to achieve desired outcomes, while in use cases motivated by recreational goals, the usage of AIGs influences the social implications of image sharing. We concluded with four distinct use cases, each highlighting how AIGs are integrated at different stages of the creative process based on varying user goals and visions.",10.1145/3706598.3713227,https://doi-org.ez24.periodicos.capes.gov.br/10.1145/3706598.3713227,"New York, NY, USA",Association for Computing Machinery,9798400713941,2025,Understanding User Perceptions and the Role of AI Image Generators in Image Creation Workflows,"Han, Shu-Jung and Fussell, Susan R.",inproceedings,10.1145/3706598.3713227,,,,,547,,,
GAITDI '25,,"AI, Content Innovation, Little Red Book, Mobile Social E-commerce, UGC",6,1–6,Proceedings of the International Conference on Implementing Generative AI into Telecommunication and Digital Innovation 2025,"Abstract :Artificial intelligence (AI) technology is rapidly developing, with increasing application in mobile social e-commerce and playing a key role in user-generated content (UGC) innovation. This article, using the women's community platform ""Little Red Book"" as an example, explores how AI empowers innovation in the UGC content ecosystem. The study finds that AI has significantly improved content production efficiency and user experience by establishing a content generation mechanism driven by female users, optimizing the dissemination pathways for lifestyle-related UGC, and enabling personalized content distribution. The practice of Little Red Book demonstrates the significant role of AI in content creation, distribution, and commercialization, providing a valuable reference for the intelligent development of social e-commerce platforms. This research has both theoretical and practical significance for understanding the integration of AI and UGC and promoting the optimization of platform content ecosystems.",10.1145/3771792.3773890,https://doi-org.ez24.periodicos.capes.gov.br/10.1145/3771792.3773890,"New York, NY, USA",Association for Computing Machinery,9798400714924,2026,Research on AI-enabled UGC Content Innovation in Mobile Social E-commerce,"Liu, Mi and Yu, Jia and Liu, Min and Zhu, Zhiqiang and Liu, Xilong and Nie, Chuanhao",inproceedings,10.1145/3771792.3773890,,,,,,,,
CHI '25,,"Generative AI, text-to-image, creativity, art, artists, global south, cultural AI evaluations, design visions, local",17,,Proceedings of the 2025 CHI Conference on Human Factors in Computing Systems,"This paper examines the potential for localized adaptation, appropriation and re-imagination of AI for non-western cultural expression, using the Persian Gulf as a case. Using sociologist Howard Becker’s concept of ‘art worlds’ as a situated lens to evaluate generative AI, we set up an eight week experimentation and dialogue between artists, art historians and curators. Our project reveals how local art worlds 1) can appropriate AI tools to address contextual and cultural needs; 2) develop “hacks” to adapt AI for culturally-specific capabilities; and 3) can be a site for imagining alternative technological trajectories. We thus showcase the importance of expanding the scope of AI evaluations to include the social dynamics AI operates in and its contexts of use. We also reflect on the power that local communities may have to interrupt AI with more culturally-relevant orientations and to offer visions for redesigning AI for non-Western creativity.",10.1145/3706598.3714049,https://doi-org.ez24.periodicos.capes.gov.br/10.1145/3706598.3714049,"New York, NY, USA",Association for Computing Machinery,9798400713941,2025,AI and Non-Western Art Worlds: Reimagining Critical AI Futures through Artistic Inquiry and Situated Dialogue,"Qadri, Rida and Mirowski, Piotr and Denton, Remi",inproceedings,10.1145/3706598.3714049,,,,,201,,,
GECCO '25 Companion,"NH Malaga Hotel, Malaga, Spain","image generation, evolutionary algorithms, genetic algorithms, diffusion models, prompt embedding, aesthetic optimization, generative AI, island model, artistic styles, simulated artistic influence, computational creativity",9,2046–2054,Proceedings of the Genetic and Evolutionary Computation Conference Companion,"This paper explores a novel approach to generative image creation by evolving prompt embeddings—the internal conditioning tensors used by diffusion models—rather than optimizing prompt text. Using SDXL-Turbo and a real-valued Genetic Algorithm within an Island Model setup, distinct artistic styles are assigned to separate islands, which evolve independently and interact via migration to stimulate stylistic influence.The goal is not to optimize a fixed objective but to explore the prompt embedding space in an open-ended manner. Evolution is guided by the Aesthetics Predictor V2 to maintain baseline visual quality, while selection pressure is kept intentionally low to preserve diversity.Image-based results demonstrate how the embedding space is traversed over generations, producing varied and sometimes unexpected combinations of artistic traits. Outputs are visualized through PCA and UMAP projections, and ancestry tracking highlights stylistic evolution. All experiments are reproducible via an open-source Jupyter Notebook accompanying this paper. The method shows that evolutionary algorithms can explore embedding spaces in a structured, interpretable way—enabling creative image generation beyond manual prompt engineering.",10.1145/3712255.3734290,https://doi-org.ez24.periodicos.capes.gov.br/10.1145/3712255.3734290,"New York, NY, USA",Association for Computing Machinery,9798400714641,2025,Open-Ended Evolution of Artistic Styles in Diffusion Models via Island-Based Genetic Algorithms,"Salvenmoser, Marcel and Affenzeller, Michael",inproceedings,10.1145/3712255.3734290,,,,,,,,
CHI '24,"Honolulu, HI, USA","design space exploration, generative AI, text to image",17,,Proceedings of the 2024 CHI Conference on Human Factors in Computing Systems,"Design space exploration (DSE) for Text-to-Image (TTI) models entails navigating a vast, opaque space of possible image outputs, through a commensurately vast input space of hyperparameters and prompt text. Perceptually small movements in prompt-space can surface unexpectedly disparate images. How can interfaces support end-users in reliably steering prompt-space explorations towards interesting results? Our design probe, DreamSheets, supports user-composed exploration strategies with LLM-assisted prompt construction and large-scale simultaneous display of generated results, hosted in a spreadsheet interface. Two studies, a preliminary lab study and an extended two-week study where five expert artists developed custom TTI sheet-systems, reveal various strategies for targeted TTI design space exploration—such as using templated text generation to define and layer semantic “axes” for exploration. We identified patterns in exploratory structures across our participants’ sheet-systems: configurable exploration “units” that we distill into a UI mockup, and generalizable UI components to guide future interfaces.",10.1145/3613904.3642858,https://doi-org.ez24.periodicos.capes.gov.br/10.1145/3613904.3642858,"New York, NY, USA",Association for Computing Machinery,9798400703300,2024,Prompting for Discovery: Flexible Sense-Making for AI Art-Making with Dreamsheets,"Almeda, Shm Garanganao and Zamfirescu-Pereira, J.D. and Kim, Kyu Won and Mani Rathnam, Pradeep and Hartmann, Bjoern",inproceedings,10.1145/3613904.3642858,,,,,160,,,
MM '25,"Dublin, Ireland","diffusion models, flux, lora, lwir, synthetic data, text-to-image, thermal imaging",10,10161–10170,Proceedings of the 33rd ACM International Conference on Multimedia,"High-quality thermal facial data is essential for advancing biometric recognition, surveillance, in-cabin driver monitoring, and human-computer interaction, all of which are integral for modern multimedia and interactive AI systems. In this work, we optimized the FLUX text-to-image diffusion model on diverse real-world thermal facial datasets to generate hyper-realistic 2D thermal facial images for both males and females, and propose a new dataset, ThermVision. To enhance their multimedia applicability, these images are processed through a video retargeting pipeline, where driving videos animate realistic facial expressions and head pose variations from a single 2D thermal image, producing high-fidelity thermal facial video sequences. The overall rendered dataset incorporates smart transformations, ensuring diversity across gender balance, extreme head pose variations, expressive facial dynamics, and facial accessories, making it a valuable resource for real-world applications. Additionally, we provide facial detection annotations to facilitate precise feature extraction and thermal-face analysis. To validate our synthetic dataset, we evaluate its effectiveness in thermal gender classification, as downstream machine learning task, along with thermal face localization and facial landmarks detection demonstrating its applicability in real-world scenarios. This approach significantly improves the availability, realism, and integration of thermal facial data, paving the way for more robust and immersive AI-powered thermal imaging applications. The dataset, code and associated models are available at- https://mali-farooq.github.io/ThermVision/",10.1145/3746027.3755448,https://doi-org.ez24.periodicos.capes.gov.br/10.1145/3746027.3755448,"New York, NY, USA",Association for Computing Machinery,9798400720352,2025,ThermVision: Exploring FLUX for Synthesizing Hyper-Realistic Thermal Face Data and Animations via Image to Video Translation,"Farooq, Muhammad Ali and Shariff, Waseem and Corcoran, Peter",inproceedings,10.1145/3746027.3755448,,,,,,,,
CHCHI '24,,"Text-to-Image Generation, User Interface Design, Qualitative Study, Input Methods, User Experience",13,321–333,Proceedings of the Twelfth International Symposium of Chinese CHI,"This paper presents a comparison of text-based and choices-based input methods in text-to-image (T2I) systems. While text-based inputs offer flexibility and creative control, they often impose a high cognitive load, especially for novice users unfamiliar with prompt engineering. Therefore, we developed and tested a new system named Choices2I, which offers a structured and choices-based interface. We compared it with the traditional text-based prompts used in GPT-4’s official web version. Our results show that users from creative industries (e.g., designers, artists, and film directors) prefer choices-based input (i.e., Choices2I) due to its flexibility and control, regardless of their expertise level. These users often have clear creative goals and find the structured options helpful in achieving specific outcomes. Conversely, non-creative industry users, who typically use T2I models for entertainment or casual purposes, favor text-based input because it is simpler and imposes less cognitive load without the pressure of making choices. This research provides critical insights into the comparison of text-based and choices-based input methods for both professional and novice users. These findings yield design insights and guidelines for building more adaptive and user-friendly T2I systems, balancing accessibility for novices with creative flexibility for professionals.",10.1145/3758871.3758896,https://doi-org.ez24.periodicos.capes.gov.br/10.1145/3758871.3758896,"New York, NY, USA",Association for Computing Machinery,9798400713897,2025,Simplifying Creativity with Choices: A User-Centered Comparison of Text-Based and Choices-Based Input Methods in Generative Models,"Chen, Yonglin and He, Yangyang and Guo, Binao and Huang, Hai and Zhang, Jingjing",inproceedings,10.1145/3758871.3758896,,,,,,,,
ASSETS '25,,"AI-fabrication, DIY-AT, Generative AI, assistive technology, customization, design tool, digital fabrication, makers",15,,Proceedings of the 27th International ACM SIGACCESS Conference on Computers and Accessibility,"Do-It-Yourself (DIY) approaches to assistive technology (AT) design offer promising opportunities for personalization and user empowerment. However, the technical complexity of digital fabrication tools continues to pose significant barriers for many AT makers, limiting broader adoption. This study explores the potential of generative AI (GenAI) to help overcome these challenges in DIY-AT design and fabrication. We developed an AI-assisted interface combining text-to-image and image-to-3D generation and evaluated it with 18 DIY-AT makers, including clinicians and technical designers, through design workshops. During these sessions, makers created and refined AT concepts, with data collected via think-aloud protocols and semi-structured interviews. The findings indicated that GenAI sparked creativity, lowered technical barriers, and supported AT personalization, especially for makers with limited design experience. However, several concerns emerged, including the generation of one-size-fits-all solutions, lack of disability-specific training data, limited accessibility features, vocabulary mismatches in clinical settings, and overall trust in AI-generated outputs. We reflect on these findings to inform the development of future AI-fabrication tools, identifying three key directions: (1) addressing data bias and accessibility gaps in AI systems, (2) expanding accessibility through inclusive interface design and diverse input modalities, and (3) reframing GenAI as a creative partner that supports disability-centered AT design and customization. Acknowledging the limitations of current AI systems, this study underscores the potential of the GenAI-assisted interface to expand access to DIY-AT, particularly for makers with diverse abilities and non-technical backgrounds.",10.1145/3663547.3746343,https://doi-org.ez24.periodicos.capes.gov.br/10.1145/3663547.3746343,"New York, NY, USA",Association for Computing Machinery,9798400706769,2025,Exploring AI-Fabrication in Shaping the Future of DIY-AT Design: Insights from Makers,"Aflatoony, Leila and Li, Mixuan and Zhang, Yiyun and Jacob, Irene and Xu, Shujian and Tang, Ziqi and Grossberg, Andre",inproceedings,10.1145/3663547.3746343,,,,,6,,,
CHI '25,,"Creative AI, Generative AI, Research through Design",16,,Proceedings of the 2025 CHI Conference on Human Factors in Computing Systems,"Cameras are increasingly augmented with computational processing, producing images that blur the line between documenting reality and creative expression. The rise of text-to-image models has redefined the concept of imagery, sparking ethical and philosophical debates. This paper presents the findings of a qualitative study that employed a provocative prototype ‘camera’ – the A(I)Cam – to engage creative practitioners directly in these discussions. Developed using a Research-through-Design (RtD) approach, the tangible prototype generates and instantly prints AI-created images. A(I)Cam facilitated reflection among creative practitioners (N=15) on their experiences with AI-driven tools and the broader implications for their future practices. We examine the shifts in perspective that emerged from engaging with this embodied form of generative AI (genAI), challenging traditional text-based interaction paradigms, and inviting new modes of creative exploration and reflection. In addition, we offer insights from the RtD project, highlighting the integration of genAI tools into the industrial design process.",10.1145/3706598.3713529,https://doi-org.ez24.periodicos.capes.gov.br/10.1145/3706598.3713529,"New York, NY, USA",Association for Computing Machinery,9798400713941,2025,Creative Reflections on Image-Making with Artificial Intelligence: Interactions with a Provocative 'Camera',"Page, Rowan and See, Jian Shin",inproceedings,10.1145/3706598.3713529,,,,,543,,,
