series,location,keywords,numpages,pages,booktitle,abstract,doi,url,address,publisher,isbn,year,title,author,ENTRYTYPE,ID,month,journal,note,issn,articleno,number,volume,issue_date
MM '24,"Melbourne VIC, Australia","backdoor attack, diffusion model, model editing",9,3657–3665,Proceedings of the 32nd ACM International Conference on Multimedia,"Text-to-image (T2I) diffusion models enjoy great popularity and many individuals and companies build their applications based on publicly released T2I diffusion models. Previous studies have demonstrated that backdoor attacks can elicit T2I diffusion models to generate unsafe target images through textual triggers. However, existing backdoor attacks typically demand substantial tuning data for poisoning, limiting their practicality and potentially degrading the overall performance of T2I diffusion models. To address these issues, we propose EvilEdit, a training-free and data-free backdoor attack against T2I diffusion models. EvilEdit directly edits the projection matrices in the cross-attention layers to achieve projection alignment between a trigger and the corresponding backdoor target. We preserve the functionality of the backdoored model using a protected whitelist to ensure the semantic of non-trigger words is not accidentally altered by the backdoor. We also propose a visual target attack EvilEdit VTA, enabling adversaries to use specific images as backdoor targets. We conduct empirical experiments on Stable Diffusion and the results demonstrate that the EvilEdit can backdoor T2I diffusion models within one second with up to 100\% success rate. Furthermore, our EvilEdit modifies only 2.2\% of the parameters and maintains the model's performance on benign prompts. Our code is available at https://github.com/haowang-cqu/EvilEdit.",10.1145/3664647.3680689,https://doi-org.ez24.periodicos.capes.gov.br/10.1145/3664647.3680689,"New York, NY, USA",Association for Computing Machinery,9798400706868,2024,EvilEdit: Backdooring Text-to-Image Diffusion Models in One Second,"Wang, Hao and Guo, Shangwei and He, Jialing and Chen, Kangjie and Zhang, Shudong and Zhang, Tianwei and Xiang, Tao",inproceedings,10.1145/3664647.3680689,,,,,,,,
CHI '25,,"Generative AI, Design, Creativity",16,,Proceedings of the 2025 CHI Conference on Human Factors in Computing Systems,"Generative AI image creation tools have the potential to transform design education and practice, but raise critical concerns for creativity and ownership. We leverage the 2022 launch of tools like Midjourney and DALL.E as a point dividing design enthusiasts into pre- and post-tool learners. In this paper, we conduct 28 artifact-based interviews with designers at varying levels of tool introduction, to understand how they perceive and use generative AI in their design roles. Our results indicate a rift in the value system of designers, with experienced designers being more circumspect about the loss of traditional creativity and foundational design skills. On the practical side, there exists a tension between the growing marketability of AI-related skills for design vs. the limited affordances of these tools for achieving meaningful designs. We discuss implications for the shifting definitions of design as a field, creativity and ownership, and AI in the design curriculum.",10.1145/3706598.3713233,https://doi-org.ez24.periodicos.capes.gov.br/10.1145/3706598.3713233,"New York, NY, USA",Association for Computing Machinery,9798400713941,2025,Catalyst for Creativity or a Hollow Trend?: A Cross-Level Perspective on The Role of Generative AI in Design,"Naqvi, Syeda Masooma and He, Ruichen and Kaur, Harmanpreet",inproceedings,10.1145/3706598.3713233,,,,,194,,,
,,"GenAI services, diffusion model, intermediary output caching, edge computing",,,,"The remarkable advancement of generative artificial intelligence (GenAI) has driven revolutionary applications for text-to-image generation, like Stable Diffusion and Imagen. Especially, the diffusion model can generate stunning images from natural language descriptions by using a reverse continuous denoising process. However, the computation burden of diffusion model-based GenAI services poses a significant hurdle for their practical implementation. In this work, we propose a novel edge computing-assisted GenAI framework to enable efficient GenAI service provision, where the intermediate output generated by diffusion models can be cached on edge servers and reused by various users to improve edge computing resource utilization. Assuming the existence of causally correlated auxiliary information, a long-term caching problem is formulated under intra-time-slot caching constraints by considering various maximally reusable steps of diffusion model-based GenAI tasks and the available caching capacity at edge servers. By leveraging the Lyapunov optimization framework, we transform the time-average caching problem into several deterministic problems for different time slots. We develop a deep reinforcement learning-based caching (DRC) algorithm to obtain caching decisions in each time slot, where a deep neural network (DNN)-based caching action generation module and a model-based evaluation module are designed. Finally, we conduct extensive simulation experiments by comparing the DRC algorithm with benchmark algorithms. The simulation results depict that the proposed DRC algorithm can reduce response time and improve cache hit rates significantly. The code is available at https://gitee.com/pipihinsky/DRC.",10.1145/3733106,https://doi-org.ez24.periodicos.capes.gov.br/10.1145/3733106,"New York, NY, USA",Association for Computing Machinery,,2025,Intermediary Output Caching for Diffusion Model-Based Text-to-Image GenAI Services in Edge Computing Networks,"Li, Yuxin and Nie, Jiangtian and Li, Shaobo and Jin, Kebing and Tang, Jianhang and Zhang, Yang and Niyato, Dusit",article,10.1145/3733106,April,ACM Trans. Embed. Comput. Syst.,Just Accepted,1539-9087,,,,
CHI '25,,"blind, accessibility, productivity applications, assistive technology, screen readers, AI assistants, Generative AI, virtual assistants",17,,Proceedings of the 2025 CHI Conference on Human Factors in Computing Systems,"Productivity applications including word processors, spreadsheets, and presentation tools are crucial in work, education, and personal settings. Blind users typically access these tools via screen readers (SRs) and face significant accessibility and usability challenges. Recent advancements in Generative AI (GenAI) may address these challenges by enabling natural language interactions and contextual task understanding. However, there is limited understanding of SR users’ needs and attitudes toward GenAI assistance in these applications. We surveyed 99 SR users to gain a holistic understanding of the challenges they face when using productivity applications, the impact of these challenges on their productivity and independence, and their initial perceptions of AI assistance. Driven by their enthusiasm, we conducted interviews with 16 SR users to explore their attitudes toward GenAI and its potential usefulness in productivity applications. Our findings highlight its need to support existing SR workflows and the importance of enabling customization and task verification.",10.1145/3706598.3713634,https://doi-org.ez24.periodicos.capes.gov.br/10.1145/3706598.3713634,"New York, NY, USA",Association for Computing Machinery,9798400713941,2025,The Sky is the Limit: Understanding How Generative AI can Enhance Screen Reader Users' Experience with Productivity Applications,"Perera, Minoli and Ananthanarayan, Swamy and Goncu, Cagatay and Marriott, Kim",inproceedings,10.1145/3706598.3713634,,,,,1165,,,
CSCW Companion '24,"San Jose, Costa Rica","ai-generated content, generative artificial intelligence, hci, metaverse, personalization, virtual reality, virtual spaces",8,497–504,Companion Publication of the 2024 Conference on Computer-Supported Cooperative Work and Social Computing,"Generative artificial intelligence (AI) has revolutionized content creation. In parallel, the Metaverse has emerged to transcend the constraints of our physical reality. While Generative AI has a multitude of exciting applications for the fields of writing, coding, and graphic design, its usage to personalize our virtual space has not yet been explored. In this paper, we investigate the application of Artificial Intelligence Generated Content (AIGC) to personalize our virtual spaces and enhance the metaverse experience. To this end, we present a pipeline to enable users to customize their virtual spaces. Moreover, we explore the hardware resources and latency required for personalized spaces, as well as user acceptance of the AI-generated spaces. Comprehensive user studies follow extensive system experiments. Our research evaluates users' perceptions of two generated spaces: panoramic images and 3D virtual spaces. According to our findings, users have shown a great interest in 3D personalized spaces, and the practicality and immersion of 3D space generation tools surpass panoramic space generation tools.",10.1145/3678884.3681897,https://doi-org.ez24.periodicos.capes.gov.br/10.1145/3678884.3681897,"New York, NY, USA",Association for Computing Machinery,9798400711145,2024,From Prompt to Metaverse: User Perceptions of Personalized Spaces Crafted by Generative AI,"Yang, Simin and Tsui, Yuk Hang and Wang, Xian and Alhilal, Ahmad and Hadi Mogavi, Reza and Wang, Xuetong and Hui, Pan",inproceedings,10.1145/3678884.3681897,,,,,,,,
AHs '25,,"large language models, generative models, eye-tracking, text-to-image, prompt engineering",13,289–301,Proceedings of the Augmented Humans International Conference 2025,"Cognitive augmentation is a cornerstone in advancing education, particularly through personalized learning. However, personalizing extensive textual materials, such as narratives and academic textbooks, remains challenging due to their heavy use, which can hinder learner engagement and understanding. Building on cognitive theories like Dual Coding Theory—which posits that combining textual and visual information enhances comprehension and memory—this study explores the potential of Generative AI (GenAI) to enrich educational materials. We utilized large language models (LLMs) to generate concise text summaries and image generation models (IGMs) to create visually aligned content from textual inputs. After recruiting 24 participants, we verified that integrating AI-generated supplementary materials significantly improved learning outcomes, increasing post-reading test scores by 7.50\%. These findings underscore GenAI’s transformative potential in creating adaptive learning environments that enhance cognitive augmentation.",10.1145/3745900.3746066,https://doi-org.ez24.periodicos.capes.gov.br/10.1145/3745900.3746066,"New York, NY, USA",Association for Computing Machinery,9798400715662,2025,GenAIReading: Augmenting Human Cognition with Interactive Digital Textbooks Using Large Language Models and Image Generation Models,"Morita, Ryugo and Watanabe, Ko and Zhou, Jinjia and Dengel, Andreas and Ishimaru, Shoya",inproceedings,10.1145/3745900.3746066,,,,,,,,
,,,5,127–131,"Proceedings of the 2025 International Conference on Computer Technology, Digital Media and Communication","Due to the world's growing urbanization and shrinking urban green spaces, micro-landscapes—small, adaptable designs such as indoor plant arrangements, pocket parks, and tabletop ornaments—are essential for enhancing ecological balance, psychological well-being, and sustainability in high-density environments. In this paper, the potential of generative AI—specifically, Google's Gemini 2.5 Flash Image Preview, known in the community as Nano Banana—in micro-landscape design is examined qualitatively. The structured AI-assisted workflow employed in the study includes iterative optimization that combines AI guidance with human evaluation, variation creation through layered prompts, input parameter specification, and semantic post-processing. This study emphasizes on the descriptive and interpretative analysis of visual outputs, design processes, and functional plausibility rather than offering quantitative performance indicators. The outcomes show how the technique can create scalable, high-quality visualizations that blend utility, aesthetics, and usability. Although issues such as functional accuracy and data quality are acknowledged, the results show how AI may speed up design processes, encourage creativity, and aid in sustainable urban development. This qualitative approach should be expanded upon in future studies with empirical backing from real-world data and larger-scale applications.",,https://doi-org.ez24.periodicos.capes.gov.br/10.1145/3783669.3783688,"New York, NY, USA",Association for Computing Machinery,9798400719523,2026,AI-Enhanced Micro-Landscape Design: Image Generation and Optimization,"Cai, Geng",inbook,10.1145/3783669.3783688,,,,,,,,
CHI '24,"Honolulu, HI, USA","Generative AI, Human-AI Interaction, Music-based Reminiscence, Older Adults, Reminiscence",17,,Proceedings of the 2024 CHI Conference on Human Factors in Computing Systems,"Music-based reminiscence has the potential to positively impact the psychological well-being of older adults. However, the aging process and physiological changes, such as memory decline and limited verbal communication, may impede the ability of older adults to recall their memories and life experiences. Given the advanced capabilities of generative artificial intelligence (AI) systems, such as generated conversations and images, and their potential to facilitate the reminiscing process, this study aims to explore the design of generative AI to support music-based reminiscence in older adults. This study follows a user-centered design approach incorporating various stages, including detailed interviews with two social workers and two design workshops (involving ten older adults). Our work contributes to an in-depth understanding of older adults’ attitudes toward utilizing generative AI for supporting music-based reminiscence and identifies concrete design considerations for the future design of generative AI to enhance the reminiscence experience of older adults.",10.1145/3613904.3642800,https://doi-org.ez24.periodicos.capes.gov.br/10.1145/3613904.3642800,"New York, NY, USA",Association for Computing Machinery,9798400703300,2024,Exploring the Design of Generative AI in Supporting Music-based Reminiscence for Older Adults,"Jin, Yucheng and Cai, Wanling and Chen, Li and Zhang, Yizhe and Doherty, Gavin and Jiang, Tonglin",inproceedings,10.1145/3613904.3642800,,,,,1012,,,
IUI '25,,"Feedback Tool, Vision Language Model, Comment Generation",16,1256–1271,Proceedings of the 30th International Conference on Intelligent User Interfaces,"Audience feedback is crucial for refining video content, yet it typically comes after publication, limiting creators’ ability to make timely adjustments. To bridge this gap, we introduce SimTube, a generative AI system designed to simulate audience feedback in the form of video comments before a video’s release. SimTube features a computational pipeline that integrates multimodal data from the video—such as visuals, audio, and metadata—with user personas derived from a broad and diverse corpus of audience demographics, generating varied and contextually relevant feedback. Furthermore, the system’s UI allows creators to explore and customize the simulated comments. Through a comprehensive evaluation—comprising quantitative analysis, crowd-sourced assessments, and qualitative user studies—we show that SimTube’s generated comments are not only relevant, believable, and diverse but often more detailed and informative than actual audience comments, highlighting its potential to help creators refine their content before release.",10.1145/3708359.3712146,https://doi-org.ez24.periodicos.capes.gov.br/10.1145/3708359.3712146,"New York, NY, USA",Association for Computing Machinery,9798400713064,2025,SimTube: Simulating Audience Feedback on Videos using Generative AI and User Personas,"Hung, Yu-Kai and Huang, Yun-Chien and Su, Ting-Yu and Lin, Yen-Ting and Cheng, Lung-Pan and Wang, Bryan and Sun, Shao-Hua",inproceedings,10.1145/3708359.3712146,,,,,,,,
ICAIE '24,,"Generative AI, artificial intelligence, bibliometric, educational technology, higher education",9,166–174,Proceedings of the 2024 3rd International Conference on Artificial Intelligence and Education,"Artificial Intelligence (AI) is positively grasped as promising to disrupt the higher education system but it also poses a number of challenges. Although so many studies attempt to explore the matching of the possibility of this growing technology with the higher education system, ample research needs to be conducted to solve the challenges facing the renovation of higher education. With this in mind, our aim of bibliometric studies is to conduct a deep investigation into the increasingly developing scenario of Generative AI tools in higher education. We extracted data from the Web of Science database that is up-to-date till July 2024, comprising 934 relevant articles. Co-citation and co-word analyses revealed three main research clusters: advanced computationable methods, AI application in higher education, and user technology and adoption. The findings illustrated rapid diffusion of generative AI technologies with prominent emphasis on large-language models in pedagogical practices. Other critical themes center around developing AI-facilitated learning interventions, ethical challenges, and usage impact on learning outcomes. The results show that the field is inherently interdisciplinary, using ideas from educational technology, cognitive science, and AI. In addition, a rising trend is noted for the focus on academic honesty and users' involvement with AI devices. The results indicate the important implications of this study for teachers and policymakers alongside contributions to teaching and research that offer a guide to sustainable improvement across education. Future research would benefit from longitudinal studies drawing on an interdisciplinary approach to realize the long-term implications and address complex issues surrounding the integration of AI within universities.",10.1145/3722237.3722266,https://doi-org.ez24.periodicos.capes.gov.br/10.1145/3722237.3722266,"New York, NY, USA",Association for Computing Machinery,9798400712692,2025,Generative AI Tools in Higher Education Emerging Research: A Bibliometric analysis of co-citation and co-word analysis,"Yang, Ye and Wen, Xiong and Maidin, Siti Sarah",inproceedings,10.1145/3722237.3722266,,,,,,,,
CHI '24,"Honolulu, HI, USA","and data augmentation, text-to-image generative model, user intent understanding",18,,Proceedings of the 2024 CHI Conference on Human Factors in Computing Systems,"Fine-tuning facilitates the adaptation of text-to-image generative models to novel concepts (e.g., styles and portraits), empowering users to forge creatively customized content. Recent efforts on fine-tuning focus on reducing training data and lightening computation overload but neglect alignment with user intentions, particularly in manual curation of multi-modal training data and intent-oriented evaluation. Informed by a formative study with fine-tuning practitioners for comprehending user intentions, we propose IntentTuner, an interactive framework that intelligently incorporates human intentions throughout each phase of the fine-tuning workflow. IntentTuner enables users to articulate training intentions with imagery exemplars and textual descriptions, automatically converting them into effective data augmentation strategies. Furthermore, IntentTuner introduces novel metrics to measure user intent alignment, allowing intent-aware monitoring and evaluation of model training. Application exemplars and user studies demonstrate that IntentTuner streamlines fine-tuning, reducing cognitive effort and yielding superior models compared to the common baseline tool.",10.1145/3613904.3642165,https://doi-org.ez24.periodicos.capes.gov.br/10.1145/3613904.3642165,"New York, NY, USA",Association for Computing Machinery,9798400703300,2024,IntentTuner: An Interactive Framework for Integrating Human Intentions in Fine-tuning Text-to-Image Generative Models,"Zeng, Xingchen and Gao, Ziyao and Ye, Yilin and Zeng, Wei",inproceedings,10.1145/3613904.3642165,,,,,182,,,
CHI '25,,"Deaf and Hard-of-Hearing (DHH) people, Music generative AI, Music-sensory substitution system, Music-making",20,,Proceedings of the 2025 CHI Conference on Human Factors in Computing Systems,"Recent advancements in text-to-music generative AI (GenAI) have significantly expanded access to music creation. However, deaf and hard of hearing (DHH) individuals remain largely excluded from these developments. This study explores how music GenAI could enhance the music-making experience of DHH individuals, who often rely on hearing people to translate sounds and music. We developed a multimodal music-making assistive tool informed by focus group interviews. This tool enables DHH users to create and edit music independently through language interaction with music GenAI, supported by integrated visual and tactile feedback. Our findings from the music-making study revealed that the system empowers them to engage in independent and proactive music-making activities, increasing their confidence, fostering musical expression, and positively shifting their attitudes toward music. Contributing to inclusive art by preserving the unique sensory characteristics of DHH individuals, this study demonstrates how music GenAI can benefit a marginalized community, fostering independent creative expression.",10.1145/3706598.3714298,https://doi-org.ez24.periodicos.capes.gov.br/10.1145/3706598.3714298,"New York, NY, USA",Association for Computing Machinery,9798400713941,2025,Exploring the Potential of Music Generative AI for Music-Making by Deaf and Hard of Hearing People,"Choi, Youjin and Moon, JaeYoung and Yoo, JinYoung and Hong, Jin-Hyuk",inproceedings,10.1145/3706598.3714298,,,,,762,,,
,,"artificial intelligence, design, generative AI, human-AI interaction",33,,,"Designing public spaces requires balancing the interests of diverse stakeholders within a constrained physical and institutional space. Designers usually approach these problems through participatory methods but struggle to incorporate diverse perspectives into design outputs. The growing capabilities of image-generative artificial intelligence (IGAI) could support participatory design. Prior work in leveraging IGAI's capabilities in design has focused on augmenting the experience and performance of individual creators. We study how IGAI could facilitate participatory processes when designing public spaces, a complex collaborative task. We conducted workshops and IGAI-mediated interviews in a real-world participatory process to upgrade a park in Los Angeles. We found (1) a shift from focusing on accuracy to fostering richer conversations as the desirable outcome of adopting IGAI in participatory design, (2) that IGAI promoted more space-aware conversations, and (3) that IGAI-mediated conversations are subject to the abilities of the facilitators in managing the interaction between themselves, the AI, and stakeholders. We contribute by discussing practical implications for using IGAI in participatory design, including success metrics, relevant skills, and asymmetries between designers and stakeholders. We finish by proposing a series of open research questions.",10.1145/3710912,https://doi-org.ez24.periodicos.capes.gov.br/10.1145/3710912,"New York, NY, USA",Association for Computing Machinery,,2025,From Fake Perfects to Conversational Imperfects: Exploring Image-Generative AI as a Boundary Object for Participatory Design of Public Spaces,"Guridi, Jose A. and Hwang, Angel Hsing-Chi and Santo, Duarte and Goula, Maria and Cheyre, Cristobal and Humphreys, Lee and Rangel, Marco",article,10.1145/3710912,May,Proc. ACM Hum.-Comput. Interact.,,,CSCW014,2,9,May 2025
IUI '25,,"HCI, LLM Evaluation, Prompt Optimization",25,341–365,Proceedings of the 30th International Conference on Intelligent User Interfaces,"Ensuring large language models’ (LLMs) responses align with prompt instructions is crucial for application development. Based on our formative study with industry professionals, the alignment requires heavy human involvement and tedious trial-and-error especially when there are many instructions in the prompt. To address these challenges, we introduce CoPrompter, a framework that identifies misalignment based on assessing multiple LLM responses with criteria. It proposes a method to generate evaluation criteria questions derived directly from prompt requirements and an interface to turn these questions into a user-editable checklist. Our user study with industry prompt engineers shows that CoPrompter improves the ability to identify and refine instruction alignment with prompt requirements over traditional methods, helps them understand where and how frequently models fail to follow user’s prompt requirements, and helps in clarifying their own requirements, giving them greater control over the response evaluation process. We also present the design lessons to underscore our system’s potential to streamline the prompt engineering process.",10.1145/3708359.3712102,https://doi-org.ez24.periodicos.capes.gov.br/10.1145/3708359.3712102,"New York, NY, USA",Association for Computing Machinery,9798400713064,2025,CoPrompter: User-Centric Evaluation of LLM Instruction Alignment for Improved Prompt Engineering,"Joshi, Ishika and Shahid, Simra and Venneti, Shreeya Manasvi and Vasu, Manushree and Zheng, Yantao and Li, Yunyao and Krishnamurthy, Balaji and Chan, Gromit Yeuk-Yin",inproceedings,10.1145/3708359.3712102,,,,,,,,
