series,location,keywords,numpages,pages,booktitle,abstract,doi,url,address,publisher,isbn,year,title,author,ENTRYTYPE,ID,month,journal,note,issn,articleno,number,volume,issue_date
CHI '24,"Honolulu, HI, USA","Creativity support tool, Graphic Design ideation, Machine Learning, Reference recombination",25,,Proceedings of the 2024 CHI Conference on Human Factors in Computing Systems,"Graphic designers often get inspiration through the recombination of references. Our formative study (N=6) reveals that graphic designers focus on conceptual keywords during this process, and want support for discovering the keywords, expanding them, and exploring diverse recombination options of them, while still having room for designers’ creativity. We propose CreativeConnect, a system with generative AI pipelines that helps users discover useful elements from the reference image using keywords, recommends relevant keywords, generates diverse recombination options with user-selected keywords, and shows recombinations as sketches with text descriptions. Our user study (N=16) showed that CreativeConnect helped users discover keywords from the reference and generate multiple ideas based on them, ultimately helping users produce more design ideas with higher self-reported creativity, compared to the baseline system without generative pipelines. While CreativeConnect was shown effective in ideation, we discussed how CreativeConnect can be extended to support other types of tasks in creativity support.",10.1145/3613904.3642794,https://doi-org.ez24.periodicos.capes.gov.br/10.1145/3613904.3642794,"New York, NY, USA",Association for Computing Machinery,9798400703300,2024,CreativeConnect: Supporting Reference Recombination for Graphic Design Ideation with Generative AI,"Choi, DaEun and Hong, Sumin and Park, Jeongeon and Chung, John Joon Young and Kim, Juho",inproceedings,10.1145/3613904.3642794,,,,,1055,,,
UIST '25,,"Extended Reality, Augmented Communication, Image-to-3D, Information Artifacts, Multi-modal, Remote Collaboration",16,,Proceedings of the 38th Annual ACM Symposium on User Interface Software and Technology,"During remote communication, participants often share both digital and physical content, such as product designs, digital assets, and environments, to enhance mutual understanding. Recent advances in augmented communication have facilitated users to swiftly create and share digital 2D copies of physical objects from video feeds into a shared space. However, conventional 2D representations of digital objects limits spatial referencing in immersive environments. To address this, we propose Thing2Reality, an Extended Reality (XR) meeting platform that facilitates spontaneous discussions of both digital and physical items during remote sessions. With Thing2Reality, users can quickly materialize ideas or objects in immersive environments and share them as conditioned multiview renderings or 3D Gaussians. Thing2Reality enables users to interact with remote objects or discuss concepts in a collaborative manner. Our user studies revealed that the ability to interact with and manipulate 3D representations of objects significantly enhances the efficiency of discussions, with the potential to augment discussion of 2D artifacts.",10.1145/3746059.3747621,https://doi-org.ez24.periodicos.capes.gov.br/10.1145/3746059.3747621,"New York, NY, USA",Association for Computing Machinery,9798400720376,2025,Thing2Reality: Enabling Spontaneous Creation of 3D Objects from 2D Content using Generative AI in XR Meetings,"Hu, Erzhen and Li, Mingyi and Hong, Jungtaek and Qian, Xun and Olwal, Alex and Kim, David and Heo, Seongkook and Du, Ruofei",inproceedings,10.1145/3746059.3747621,,,,,53,,,
CHI '24,"Honolulu, HI, USA","creativity support, interview, lab study, prototyping/implementation, qualitative methods, quantitative methods",14,,Proceedings of the 2024 CHI Conference on Human Factors in Computing Systems,"Unfamiliar measurements usually hinder readers from grasping the scale of the numerical data, understanding the content, and feeling engaged with the context. To enhance data comprehension and communication, we leverage analogies to bridge the gap between abstract data and familiar measurements. In this work, we first conduct semi-structured interviews with design experts to identify design problems and summarize design considerations. Then, we collect an analogy dataset of 138 cases from various online sources. Based on the collected dataset, we characterize a design space for creating data analogies. Next, we build a prototype system, AnalogyMate, that automatically suggests data analogies, their corresponding design solutions, and generated visual representations powered by generative AI. The study results show the usefulness of AnalogyMate in aiding the creation process of data analogies and the effectiveness of data analogy in enhancing data comprehension and communication.",10.1145/3613904.3642480,https://doi-org.ez24.periodicos.capes.gov.br/10.1145/3613904.3642480,"New York, NY, USA",Association for Computing Machinery,9798400703300,2024,Beyond Numbers: Creating Analogies to Enhance Data Comprehension and Communication with Generative AI,"Chen, Qing and Shuai, Wei and Zhang, Jiyao and Sun, Zhida and Cao, Nan",inproceedings,10.1145/3613904.3642480,,,,,377,,,
CHI '24,"Honolulu, HI, USA","Expressive arts therapy, children, family, generative AI, human-AI interaction., storymaking",21,,Proceedings of the 2024 CHI Conference on Human Factors in Computing Systems,"Storymaking, as an integrative form of expressive arts therapy, is an effective means to foster family communication. Yet, the integration of generative AI as expressive materials in therapeutic storymaking remains underexplored. And there is a lack of HCI implications on how to support families and therapists in this context. Addressing this, our study involved five weeks of storymaking sessions with seven families guided by a professional therapist. In these sessions, the families used both traditional art-making materials and image-based generative AI to create and evolve their family stories. Via the rich empirical data and commentaries from four expert therapists, we contextualize how families creatively melded AI and traditional expressive materials to externalize their ideas and feelings. Through the lens of Expressive Therapies Continuum (ETC), we characterize the therapeutic implications of AI as expressive materials. Desirable interaction qualities to support children, parents, and therapists are distilled for future HCI research.",10.1145/3613904.3642852,https://doi-org.ez24.periodicos.capes.gov.br/10.1145/3613904.3642852,"New York, NY, USA",Association for Computing Machinery,9798400703300,2024,"""When He Feels Cold, He Goes to the Seahorse""—Blending Generative AI into Multimaterial Storymaking for Family Expressive Arts Therapy","Liu, Di and Zhou, Hanqing and An, Pengcheng",inproceedings,10.1145/3613904.3642852,,,,,118,,,
CHIIR '23,"Austin, TX, USA","case study, evaluation, generative models, image retrieval",15,172–186,Proceedings of the 2023 Conference on Human Information Interaction and Retrieval,"Conditional generative models such as DALL-E and Stable Diffusion generate images based on a user-defined text, the prompt. Finding and refining prompts that produce a desired image has become the art of prompt engineering. Generative models do not provide a built-in retrieval model for a user’s information need expressed through prompts. In light of an extensive literature review, we reframe prompt engineering for generative models as interactive text-based retrieval on a novel kind of “infinite index”. We apply these insights for the first time in a case study on image generation for game design with an expert. Finally, we envision how active learning may help to guide the retrieval of generated images.",10.1145/3576840.3578327,https://doi-org.ez24.periodicos.capes.gov.br/10.1145/3576840.3578327,"New York, NY, USA",Association for Computing Machinery,9798400700354,2023,The Infinite Index: Information Retrieval on Generative Text-To-Image Models,"Deckers, Niklas and Fr\""{o}be, Maik and Kiesel, Johannes and Pandolfo, Gianluca and Schr\""{o}der, Christopher and Stein, Benno and Potthast, Martin",inproceedings,10.1145/3576840.3578327,,,,,,,,
CHI '25,,"Creativity Support, Writing Assistants, Visualization, Human-AI Collaboration",30,,Proceedings of the 2025 CHI Conference on Human Factors in Computing Systems,"As story writing requires diverse resources, a single system combining these resources could improve personalization. We leverage the broad capabilities of generative AI to support both more general story writing needs and an understudied but essential aspect: reflection on the moral (lesson) conveyed. Through a formative study (N=12), a user study (N=14), and external evaluation (N=19), we designed, implemented, then studied a prototype plugin for FigJam supporting visualization of the story structure through customizable node graph editing, LLM audience impersonation (chatbot and non-chatbot interfaces), and image and audio generative AI features. Our findings support writers’ preference for leveraging unique interplays of our breadth of features to satisfy shifting needs across writing processes, from conveying a moral across audience groups to story writing in general. We discuss how our tool design and findings can inform model bias, personalized writing support, and visualization research.",10.1145/3706598.3713569,https://doi-org.ez24.periodicos.capes.gov.br/10.1145/3706598.3713569,"New York, NY, USA",Association for Computing Machinery,9798400713941,2025,Toward Personalizable AI Node Graph Creative Writing Support: Insights on Preferences for Generative AI Features and Information Presentation Across Story Writing Processes,"Qin, Hua Xuan and Zhu, Guangzhi and Fan, Mingming and Hui, Pan",inproceedings,10.1145/3706598.3713569,,,,,897,,,
Onward! 2023,"Cascais, Portugal","self-efficacy, prompt engineering, live programming, learning barriers, generative shift hypothesis, end-user software customization, attention investment model",15,153–167,"Proceedings of the 2023 ACM SIGPLAN International Symposium on New Ideas, New Paradigms, and Reflections on Programming and Software","The research field of end-user programming has largely been concerned with helping non-experts learn to code sufficiently well in order to achieve their tasks. Generative AI stands to obviate this entirely by allowing users to generate code from naturalistic language prompts. In this essay, we explore the extent to which ""traditional"" programming languages remain relevant for non-expert end-user programmers in a world with generative AI. We posit the ""generative shift hypothesis"": that generative AI will create qualitative and quantitative expansions in the traditional scope of end-user programming. We outline some reasons that traditional programming languages may still be relevant and useful for end-user programmers. We speculate whether each of these reasons might be fundamental and enduring, or whether they may disappear with further improvements and innovations in generative AI. Finally, we articulate a set of implications for end-user programming research, including the possibility of needing to revisit many well-established core concepts, such as Ko's learning barriers and Blackwell's attention investment model.",10.1145/3622758.3622882,https://doi-org.ez24.periodicos.capes.gov.br/10.1145/3622758.3622882,"New York, NY, USA",Association for Computing Machinery,9798400703881,2023,Will Code Remain a Relevant User Interface for End-User Programming with Generative AI Models?,"Sarkar, Advait",inproceedings,10.1145/3622758.3622882,,,,,,,,
BDSIC '24,"Hong Kong, Hong Kong","AI, Firebase, VR",6,86–91,Proceedings of the 2024 6th International Conference on Big-Data Service and Intelligent Computation,"In this Project, we developed a cognitive rehabilitation program for dementia patients, leveraging generative AI and virtual reality (VR) to evoke personal memories [4]. Integrating Open AI, DreamStudio, and Unity, our system allows patients to input descriptions, generating visual memories in a VR environment [5]. In trials, 85\% of AI-generated images matched patients' expectations, although some inaccuracies arose from AI generalizations. Further validation with dementia patients is needed to assess memory recovery impacts. This novel approach modernizes Cognitive Stimulation Therapy (CST), traditionally reliant on non-visual exercises, by incorporating AI and VR to enhance memory recall and visual-spatial skills.While the world is developing more and more into Artificial Intelligence (AI) and Virtual Reality (VR), our program successfully coordinates them to help stimulate dementia patients’ brains and perform the memory recall and visual spatial aspects of CST.",10.1145/3686540.3686552,https://doi-org.ez24.periodicos.capes.gov.br/10.1145/3686540.3686552,"New York, NY, USA",Association for Computing Machinery,9798400718069,2024,Enhancing Cognitive Recall in Dementia Patients: Integrating Generative AI with Virtual Reality for Behavioral and Memory Rehabilitation,"Wang, Yubo and Zhang, Yujia",inproceedings,10.1145/3686540.3686552,,,,,,,,
IECT '24,"Guilin, China",,6,606–611,Proceedings of the 2024 International Conference on Intelligent Education and Computer Technology,"The purpose of this study is to explore the application of generative artificial intelligence (AI) in Chinese literacy teaching in the first grade of primary school and its influence on teachers' practical knowledge construction and teaching innovation. Through two rounds of action research, this study deeply analyzes the practical effect of AI tools in assisting teachers in learning situation analysis, personalized teaching design and classroom interaction. Through the analysis of process data and interviews such as AI use process record form and classroom observation scale, the research found that, on the one hand, the learning situation analysis function of AI tools provides strong data support for teachers through in-depth insight into students' literacy ability and learning style. On the other hand, the iterative dialogue between AI and teachers promotes teachers 'in-depth understanding of literacy teaching content, and stimulates their innovative teaching thinking. The proper application of generative AI technology in the field of education not only improves teaching efficiency, but also provides a new way for teachers' professional development and promotion of practical knowledge.",10.1145/3687311.3687419,https://doi-org.ez24.periodicos.capes.gov.br/10.1145/3687311.3687419,"New York, NY, USA",Association for Computing Machinery,9798400709920,2024,Technological Dialogue and Intelligent Generation: An Empirical Study of Primary Chinese Teachers Using Generative AI for Lesson Preparation,"Huang, Cuitian and Yu, Hong",inproceedings,10.1145/3687311.3687419,,,,,,,,
FAccT '24,"Rio de Janeiro, Brazil","anticipatory governance, chatbots, impact assessment, scenario-writing",15,2071–2085,"Proceedings of the 2024 ACM Conference on Fairness, Accountability, and Transparency","As a general purpose technology without a concrete pre-defined purpose, personal chatbots can be used for a whole range of objectives, depending on the personal needs, contexts, and tasks of an individual, and so potentially impact a variety of values, people, and social contexts. Traditional methods of risk assessment are confronted with several challenges: the lack of a clearly defined technology purpose, the lack of clearly defined values to orient on, the heterogeneity of uses, and the difficulty of actively engaging citizens themselves in anticipating impacts from the perspective of their individual lived realities. In this article, we leverage scenario writing at scale as a method for anticipating AI impact that is responsive to these challenges. The advantages of the scenario method are its ability to engage individual users and stimulate them to consider how chatbots are likely to affect their reality and so collect different impact scenarios depending on the cultural and societal embedding of a heterogeneous citizenship. Empirically, we tasked 106 US-based participants to write short fictional stories about the future impact (whether desirable or undesirable) of AI-based personal chatbots on individuals and society and, in addition, ask respondents to explain why these impacts are important and how they relate to their values. In the analysis process, we map those impacts and analyze them in relation to socio-demographic as well as AI-related attitudes of the scenario writers. We show that our method is effective in (1) identifying and mapping desirable and undesirable impacts of AI-based personal chatbots, (2) setting these impacts in relation to values that are important for individuals, and (3) detecting socio-demographic and AI-attitude related differences of impact anticipation.",10.1145/3630106.3659026,https://doi-org.ez24.periodicos.capes.gov.br/10.1145/3630106.3659026,"New York, NY, USA",Association for Computing Machinery,9798400704505,2024,"My Future with My Chatbot: A Scenario-Driven, User-Centric Approach to Anticipating AI Impacts","Kieslich, Kimon and Helberger, Natali and Diakopoulos, Nicholas",inproceedings,10.1145/3630106.3659026,,,,,,,,
ICISE '23,"Bangkok, Thailand","API Code Generation, Anti Money Laundering (AML), Enterprise Resource Planning (ERP) Integration, Generative Artificial Intelligence (AI), Natural Language Processing (NLP)",8,177–184,Proceedings of the 2023 8th International Conference on Information Systems Engineering,"This research delves into integrating Natural Language Processing (NLP) and Generative AI within Enterprise Resource Planning (ERP) systems to bolster fraud prevention measures. The study commences by thoroughly mapping the fraud tree taxonomy with existing ERP applications to identify areas susceptible to fraudulent activities, encompassing corruption, asset misappropriation, and financial statement fraud. The research proposes the utilisation of specific NLP and Generative AI APIs tailored to address these areas, effectively building upon these identified vulnerabilities. By establishing standardised criteria for API development, the research provides a comprehensive roadmap for the accounting and finance profession to adopt and implement these advanced technologies to combat fraud more efficiently. The suggested roadmap encompasses crucial stages, including evaluating organisational requirements, assessing API providers, seamlessly integrating APIs into ERP systems, conducting thorough testing, and establishing robust monitoring and governance mechanisms. The findings underscore the tremendous potential of NLP and Generative AI in fortifying fraud prevention endeavours within ERP systems while highlighting the interdisciplinary nature of this research, which amalgamates insights from ERP systems, fraud detection, NLP, and Generative AI. The study also encourages future empirical investigations to validate and refine the proposed solutions within real-world contexts.",10.1145/3641032.3641065,https://doi-org.ez24.periodicos.capes.gov.br/10.1145/3641032.3641065,"New York, NY, USA",Association for Computing Machinery,9798400709173,2024,Blazing a New Trail in ERP Integration with NLP and Generative AI through APIs: a fraud examination perspective,"Faccia, Alessio and Manni, Francesco and Pandey, Vishal and Cavaliere, Luigi Pio Leonardo",inproceedings,10.1145/3641032.3641065,,,,,,,,
CHCHI '23,"Denpasar, Bali, Indonesia","AI-assisted Design, Avatar Design, Co-creation Experience, Generative AI, Human-AI Collaboration, Stakeholder Identification",18,596–613,Proceedings of the Eleventh International Symposium of Chinese CHI,"Nowadays, the traditional workflow of designers’ completing complicated design tasks has undergone a profound transformation due to the pervasive intervention of generative artificial intelligence (AI) tools, especially when multi-stakeholder participation is getting involved in the design process. Yet we know little about the designers’ perceptions and practices of collaborating with generative AI as a co-creative agent within the context of multi-stakeholder participation. To investigate these questions, we took the domain of avatar design as an example and conducted a qualitative interview study with 21 expert avatar designers who have got different levels of experience and expertise in utilizing generative AI tools in their design workflow. We found that designers not only would fall in a dilemma when deciding whether to consider AI as a co-creative agent according to different stakeholders’ interests, but they also face many challenges in effectively co-creating with the current systems, including challenges in consistently adjusting AI outputs and getting design inspiration within the iterative generation process, etc. Based on our findings, we concluded both the epistemological and creative patterns of collaborating with generative AI and highlighted several design opportunities from both technical and ethical perspectives to better support future designer-AI co-creation.",10.1145/3629606.3629675,https://doi-org.ez24.periodicos.capes.gov.br/10.1145/3629606.3629675,"New York, NY, USA",Association for Computing Machinery,9798400716454,2024,Exploring Designers’ Perceptions and Practices of Collaborating with Generative AI as a Co-creative Agent in a Multi-stakeholder Design Process: Take the Domain of Avatar Design as an Example,"He, Qingyang and Zheng, Weicheng and Bao, Hanxi and Chen, Ruiqi and Tong, Xin",inproceedings,10.1145/3629606.3629675,,,,,,,,
GAIDMA '25,,"Generative design method, Generative model, Intangible Cultural Heritage (ICH), Yuxian paper-cutting style",8,75–82,Proceedings of the 2025 International Conference on Generative AI and Digital Media Arts,"Objective, This study uses Yuxian paper-cutting as a case study to analyze fundamental limitations in mainstream generative models and investigates generative design methods capable of accurately reproducing the Yuxian paper-cutting style. Method, The paper examines the technical process and developmental trends of Yuxian paper-cutting, analyzes policy support for generative AI in paper-cutting design, and discusses the constraints of mainstream generative models in data training. To address their inadequacy in replicating the Yuxian style, this research reconstructs a high-quality dataset of paper-cutting images, trains a specialized generative model, and employs visual evaluation methods to validate its effectiveness and feasibility. Conclusion, This study proposes an AI-based generative design method for Yuxian paper-cutting. It surpasses both traditional methods and mainstream generative models in design efficiency and artistic expression while demonstrating high reusability. The method effectively reproduces the visual style and technical characteristics of Yuxian paper-cutting, fosters the integration of cultural innovation and technology, and provides a novel pathway for the revitalization and innovation of intangible cultural heritage.",10.1145/3770445.3770458,https://doi-org.ez24.periodicos.capes.gov.br/10.1145/3770445.3770458,"New York, NY, USA",Association for Computing Machinery,9798400718519,2025,Research on Generative Design Methods for Yuxian Paper-Cutting Style of Intangible Cultural Heritage,"Wang, Yu and Zhou, Yaqin",inproceedings,10.1145/3770445.3770458,,,,,,,,
CSLAW '24,"Boston, MA, USA",,16,48–63,Proceedings of the 2024 Symposium on Computer Science and Law,"""Does generative AI infringe copyright?"" is an urgent question. It is also a difficult question, for two reasons. First, ""generative AI"" is not just one product from one company. It is a catch-all name for a massive ecosystem of loosely related technologies. These systems behave differently and raise different legal issues. Second, copyright law is notoriously complicated, and generative-AI systems manage to touch on a great many corners of it. They raise issues of authorship, similarity, direct and indirect liability, and fair use, among much else. These issues cannot be analyzed in isolation, because there are connections everywhere. We aim to bring order to the chaos. To do so, we introduce the generative-AI supply chain: an interconnected set of stages that transform training data into generations. The supply chain reveals all of the places at which companies and users make choices that have copyright consequences. It enables us to trace the effects of upstream technical designs on downstream uses, and to assess who in these complicated sociotechnical systems bears responsibility for infringement when it happens. Because we engage so closely with the technology of generative AI, we are able to shed more light on the copyright questions. We identify the key decisions that courts will need to make as they grapple with these issues, and point out the consequences that would likely flow from different liability regimes. This article is a much-abbreviated version of a forthcoming law review article at The Journal of the Copyright Society.",10.1145/3614407.3643696,https://doi-org.ez24.periodicos.capes.gov.br/10.1145/3614407.3643696,"New York, NY, USA",Association for Computing Machinery,9798400703331,2024,Talkin' 'Bout AI Generation: Copyright and the Generative-AI Supply Chain (The Short Version),"Lee, Katherine and Cooper, A. Feder and Grimmelmann, James",inproceedings,10.1145/3614407.3643696,,,,,,,,
